<?xml version="1.0" encoding="UTF-8"?>
<bpelApplication name="ba"
  xmlns="http://jbpm.org/bpel" 
  xmlns:xsi="http://www.w3.org/2001/XMLSchema-instance" 
  xsi:schemaLocation="http://jbpm.org/bpel
                      http://jbpm.org/bpel/bpel_application_1_0.xsd">
  <partnerLinks>
    <partnerLink name="pl">
      <myRole handle="pl2" />
    </partnerLink>
  </partnerLinks>
  <scopes>
    <scope name="s1">
      <partnerLinks>
        <partnerLink name="pl">
          <myRole handle="pl1" />
        </partnerLink>
        <partnerLink name="pla">
          <myRole handle="pla" />
        </partnerLink>
      </partnerLinks>
    </scope>
    <scope name="s2">
      <scopes>
        <scope name="s3" />
      </scopes>
    </scope>
  </scopes>
  <serviceCatalogs>
    <urlCatalog>
      <wsdl location="partnerLinkTypeSample.wsdl" />
      <wsdl location="propertyAliasSample.wsdl" />
    </urlCatalog>
  </serviceCatalogs>
</bpelApplication>